{"$schema":"urn:programmable:active-contract-manifest:2.0.0","artifacts":{"package":[{"path":".programmable/applicant-compatibility.v2.json","sha256":"sha256:76c093cea1a56267503a1d35fc10ff3b8e53836ad8e9e552939a6712cc16acf8"},{"path":"canary/schemas/workflow-canary-application-v1.schema.json","sha256":"sha256:51c47dc028482f71cd81204c5ae231f8e59015b3fae10138a0b41d90481981c4"},{"path":"canary/schemas/workflow-canary-result-v1.schema.json","sha256":"sha256:16b84c27e7f75c5d1f5ebe07d2a6e31594a2269e881bf2914c3ad60e774a3547"},{"path":"intake/schemas/active-contract-manifest-v2.schema.json","sha256":"sha256:7302d8b792ba5b68d2acff318864d8db086aebe8289303bf77974c92b620b87a"},{"path":"intake/schemas/applicant-compatibility-v2.schema.json","sha256":"sha256:01de8cd2e99c1e7d76b701377b42ee33df492bcebdb869d6d71a3d2a148a9df8"},{"path":"intake/schemas/open-world-submission-v2.1.schema.json","sha256":"sha256:fb30065f906903530ba74cb0a20cd398d36bb387143cb0bae30326450e88ea23"},{"path":"intake/schemas/programmable-launch-router-readiness-v1.schema.json","sha256":"sha256:1d551f16704d764e749a4adf913eb44c63f3fab73c7948e0d18749ff3e57c551"},{"path":"intake/schemas/public-pr-application-v3.2.schema.json","sha256":"sha256:69fd860c82c0426d853f96fbf8df53c70de0e824a258da940a5ef09a68c72988"},{"path":"intake/schemas/public-pr-application-v3.schema.json","sha256":"sha256:2d51837bbbfe52672ecca334596243bebcec78e8e0a885d67084dfd98955bcb7"},{"path":"intake/schemas/trade-capability-manifest-v2.schema.json","sha256":"sha256:a466baae3111a33cc33a2651b13f37da7dcc2d13d2cedce993896d289a82950f"},{"path":"policy/schemas/launch-policy-binding.v1.schema.json","sha256":"sha256:7986f41333e612b15e60a22b6336e25dda381fac44e303ceeec91c666b89cef8"},{"path":"policy/schemas/launch-policy.v1.schema.json","sha256":"sha256:5f3fb9e1e430fc8bd481ad36d6fd1aba6b0044c23c92219075b1a7277ae3f38e"},{"path":"policy/schemas/programmable-runtime-fee-settlement-proof-v1.schema.json","sha256":"sha256:f92aba68465c3e88a9fe1d726cbcf4b3d86939efdb4a1a9f527153274a116e4d"},{"path":"registry/schema/launch-stamp-promotion-v1.schema.json","sha256":"sha256:b5499b4708c9fe427d867d20d1c1a802da2fc65bca93ccfd26b867d68bcd55ea"},{"path":"review/schemas/launch-policy-review-decision.v1.schema.json","sha256":"sha256:ac261b9166c95914bed984e0623bab6240cf858cc40677c9e6698c9a355e20aa"},{"path":"review/schemas/launch-policy-review-input.v1.schema.json","sha256":"sha256:0c577d25d00ea1575bb34795f6d126c485624e796f39284eeadc30e93613f8eb"},{"path":"vendor/programmable-v4-hook-builder/references/public-pr-application.schema.json","sha256":"sha256:a9b5af920381aaa2f18b1a0ccab3d3c5617d9ca7777372d56b80d37961ba3af2"}],"policy":[{"path":"policy/launch-policy.v1.json","sha256":"sha256:2309142acd496fb535640066dbfdf08abaf51ae1090242601c691ccc36965c03"}],"validator":[{"path":"review/launch-policy-review-core.mjs","sha256":"sha256:39c85f9fa9f24b049283deba83950f4340079199a67ef5e3d7394f0cc402638c"},{"path":"scripts/active-contract-manifest-core.mjs","sha256":"sha256:0f76a6495cb279904fb9f7385faa46c22aabe36fd024f3909c52c9f0deef98d1"},{"path":"scripts/applicant-v3_2-scaffold-core.mjs","sha256":"sha256:1c78f99b27abd1d3deb1be315bfe4270fc15427f1248477b20ae0de575880969"},{"path":"scripts/applicant-v3_2-scaffold.mjs","sha256":"sha256:8a48de14fca8e4868705540397c52665167cbb3b44c94a8a31c5c707b9bc1e2d"},{"path":"scripts/programmable-launch-router-readiness-core.mjs","sha256":"sha256:f4f70d2720063598d3e9da03bb5d757ca050dbca17266f9788b572fa96976275"},{"path":"scripts/programmable-launch-router-readiness.mjs","sha256":"sha256:233906c47fdbf5a8cde2053c71988810c523ad35c6409c2f8469ae95b46b912a"},{"path":"scripts/programmable-runtime-fee-settlement-proof-core.mjs","sha256":"sha256:27c439fdac7951c985dff6be7b35ca4c0ecdf1581682cd6c2c21d2e434c14780"},{"path":"scripts/programmable-runtime-fee-settlement-proof-validation.mjs","sha256":"sha256:a49d81853931abe0d0d93b0a49c40ef0ab2d9fe4b3811259169d59a0c67120e4"},{"path":"scripts/registry-core.mjs","sha256":"sha256:829cec7e39fd3371de637a89e0d2d88f7b099d9bd80610c83f7313f268151911"},{"path":"scripts/verify-open-world-v2-contracts.mjs","sha256":"sha256:3df05d93f98fa84a8c00ea116d6a0a132595a15e13d15e6f7ab4ad11cb9a440b"},{"path":"scripts/verify-open-world-v2-trade-manifest-v2.mjs","sha256":"sha256:11fcc2a82368275697d6abff7681b4a56b1b6c522a9b3259a9eafc3105429788"},{"path":"scripts/verify-public-hook-application.mjs","sha256":"sha256:28260aad6879cd5c605a168a9599c08e5488e3eb48fcf6e0940765333c5705db"},{"path":"scripts/verify-public-application-v3-core.mjs","sha256":"sha256:0a0cfa65a458c91f934ef9f298dbf8a6b9f3a2be3f0b72cb0da8b0e3249142cd"},{"path":"scripts/verify-public-application-v3-shared.mjs","sha256":"sha256:6e8bf459f7eedfbfd08a037609c1986d5cc010b370d8c654cabb261fc273b595"},{"path":"scripts/verify-workflow-canary.mjs","sha256":"sha256:022e2e34fb817ad46f5e52c0f84715b0f932653b2a789894512b947a800b3244"}],"workflow":[{"path":".github/workflows/verify-hook-builder.yml","sha256":"sha256:71ee0d5f648c1a8da0d82e4c5f73a73c37f9184ade9b9dd2018dbe1300911786"}]},"contractId":"submit-launch","defaultBranch":"main","kind":"programmable-active-contract","schemaVersion":"2.0.0"}
